No.,Time,Source,Destination,Protocol,Length,Info,
5,0.115482,192.168.246.153,192.168.246.232,TCP,60,51356  >  8080 [ACK] Seq=1 Ack=1 Win=2053 Len=0,
6,0.115512,192.168.246.153,192.168.246.232,TCP,60,51356  >  8080 [ACK] Seq=1 Ack=2469 Win=2053 Len=0,
7,0.115518,192.168.246.153,192.168.246.232,TCP,60,51356  >  8080 [ACK] Seq=1 Ack=4937 Win=2053 Len=0,
8,0.115522,192.168.246.153,192.168.246.232,TCP,60,51356  >  8080 [ACK] Seq=1 Ack=7405 Win=2053 Len=0,
9,0.115527,192.168.246.153,192.168.246.232,TCP,60,51356  >  8080 [ACK] Seq=1 Ack=9873 Win=2053 Len=0,
10,0.115533,192.168.246.153,192.168.246.232,TCP,60,51356  >  8080 [ACK] Seq=1 Ack=12341 Win=2053 Len=0,
11,0.115539,192.168.246.153,192.168.246.232,TCP,60,51356  >  8080 [ACK] Seq=1 Ack=14809 Win=2053 Len=0,
12,0.115544,192.168.246.153,192.168.246.232,TCP,60,51356  >  8080 [ACK] Seq=1 Ack=17277 Win=2053 Len=0,
13,0.119278,192.168.246.232,192.168.246.153,TCP,1288,8080  >  51356 [ACK] Seq=22213 Ack=1 Win=174 Len=1234,
14,0.120584,192.168.246.232,192.168.246.153,TCP,1288,8080  >  51356 [ACK] Seq=23447 Ack=1 Win=174 Len=1234,
15,0.120837,192.168.246.232,192.168.246.153,TCP,1288,8080  >  51356 [ACK] Seq=24681 Ack=1 Win=174 Len=1234,
16,0.120837,192.168.246.232,192.168.246.153,TCP,1288,8080  >  51356 [ACK] Seq=25915 Ack=1 Win=174 Len=1234,
17,0.121285,192.168.246.232,192.168.246.153,TCP,1288,8080  >  51356 [ACK] Seq=27149 Ack=1 Win=174 Len=1234,
18,0.121285,192.168.246.232,192.168.246.153,TCP,1288,8080  >  51356 [ACK] Seq=28383 Ack=1 Win=174 Len=1234,
19,0.121799,192.168.246.232,192.168.246.153,TCP,1288,8080  >  51356 [ACK] Seq=29617 Ack=1 Win=174 Len=1234,
20,0.121799,192.168.246.232,192.168.246.153,TCP,1288,8080  >  51356 [ACK] Seq=30851 Ack=1 Win=174 Len=1234,
21,0.12207,192.168.246.232,192.168.246.153,TCP,1288,8080  >  51356 [ACK] Seq=32085 Ack=1 Win=174 Len=1234,
22,0.12207,192.168.246.232,192.168.246.153,TCP,1288,8080  >  51356 [ACK] Seq=33319 Ack=1 Win=174 Len=1234,
23,0.122623,192.168.246.232,192.168.246.153,TCP,1288,8080  >  51356 [ACK] Seq=34553 Ack=1 Win=174 Len=1234,
24,0.122623,192.168.246.232,192.168.246.153,TCP,1288,8080  >  51356 [ACK] Seq=35787 Ack=1 Win=174 Len=1234,
25,0.122623,192.168.246.232,192.168.246.153,TCP,1288,8080  >  51356 [ACK] Seq=37021 Ack=1 Win=174 Len=1234,
26,0.123064,192.168.246.232,192.168.246.153,TCP,1288,8080  >  51356 [ACK] Seq=38255 Ack=1 Win=174 Len=1234,
27,0.123064,192.168.246.232,192.168.246.153,TCP,1288,8080  >  51356 [ACK] Seq=39489 Ack=1 Win=174 Len=1234,
28,0.123317,192.168.246.232,192.168.246.153,TCP,1288,8080  >  51356 [ACK] Seq=40723 Ack=1 Win=174 Len=1234,
29,0.123317,192.168.246.232,192.168.246.153,TCP,1288,8080  >  51356 [ACK] Seq=41957 Ack=1 Win=174 Len=1234,
30,0.123765,192.168.246.232,192.168.246.153,TCP,1288,8080  >  51356 [ACK] Seq=43191 Ack=1 Win=174 Len=1234,
31,0.124107,192.168.246.232,192.168.246.153,TCP,1288,8080  >  51356 [ACK] Seq=44425 Ack=1 Win=174 Len=1234,
32,0.378598,192.168.246.153,192.168.246.232,TCP,60,51356  >  8080 [ACK] Seq=1 Ack=19745 Win=2053 Len=0,
33,0.386265,192.168.246.232,192.168.246.153,TCP,1288,8080  >  51356 [ACK] Seq=45659 Ack=1 Win=174 Len=1234,
34,0.386265,192.168.246.232,192.168.246.153,TCP,1288,8080  >  51356 [ACK] Seq=46893 Ack=1 Win=174 Len=1234,
35,0.386647,192.168.246.232,192.168.246.153,TCP,1288,8080  >  51356 [ACK] Seq=48127 Ack=1 Win=174 Len=1234,
57,0.946858,192.168.246.153,192.168.246.232,TCP,60,51356  >  8080 [ACK] Seq=1 Ack=22213 Win=2053 Len=0,
58,0.949822,192.168.246.232,192.168.246.153,TCP,1288,8080  >  51356 [ACK] Seq=49361 Ack=1 Win=174 Len=1234,
59,0.950016,192.168.246.232,192.168.246.153,TCP,1288,8080  >  51356 [ACK] Seq=50595 Ack=1 Win=174 Len=1234,
62,1.131836,192.168.246.153,192.168.246.232,TCP,60,51356  >  8080 [ACK] Seq=1 Ack=24681 Win=2053 Len=0,
63,1.131881,192.168.246.153,192.168.246.232,TCP,60,51356  >  8080 [ACK] Seq=1 Ack=27149 Win=2053 Len=0,
64,1.131887,192.168.246.153,192.168.246.232,TCP,60,51356  >  8080 [ACK] Seq=1 Ack=29617 Win=2053 Len=0,
65,1.131894,192.168.246.153,192.168.246.232,TCP,60,51356  >  8080 [ACK] Seq=1 Ack=32085 Win=2053 Len=0,
66,1.1319,192.168.246.153,192.168.246.232,TCP,60,51356  >  8080 [ACK] Seq=1 Ack=34553 Win=2053 Len=0,
67,1.131908,192.168.246.153,192.168.246.232,TCP,60,51356  >  8080 [ACK] Seq=1 Ack=37021 Win=2053 Len=0,
68,1.131914,192.168.246.153,192.168.246.232,TCP,60,51356  >  8080 [ACK] Seq=1 Ack=39489 Win=2053 Len=0,
69,1.13192,192.168.246.153,192.168.246.232,TCP,60,51356  >  8080 [ACK] Seq=1 Ack=41957 Win=2053 Len=0,
70,1.131927,192.168.246.153,192.168.246.232,TCP,60,51356  >  8080 [ACK] Seq=1 Ack=44425 Win=2053 Len=0,
71,1.135035,192.168.246.232,192.168.246.153,TCP,1288,8080  >  51356 [ACK] Seq=51829 Ack=1 Win=174 Len=1234,
72,1.135035,192.168.246.232,192.168.246.153,TCP,1288,8080  >  51356 [ACK] Seq=53063 Ack=1 Win=174 Len=1234,
73,1.136254,192.168.246.232,192.168.246.153,TCP,1288,8080  >  51356 [ACK] Seq=54297 Ack=1 Win=174 Len=1234,
74,1.136518,192.168.246.232,192.168.246.153,TCP,1288,8080  >  51356 [ACK] Seq=55531 Ack=1 Win=174 Len=1234,
75,1.136781,192.168.246.232,192.168.246.153,TCP,1288,8080  >  51356 [ACK] Seq=56765 Ack=1 Win=174 Len=1234,
76,1.136781,192.168.246.232,192.168.246.153,TCP,1288,8080  >  51356 [ACK] Seq=57999 Ack=1 Win=174 Len=1234,
77,1.137053,192.168.246.232,192.168.246.153,TCP,1288,8080  >  51356 [ACK] Seq=59233 Ack=1 Win=174 Len=1234,
78,1.137053,192.168.246.232,192.168.246.153,TCP,1288,8080  >  51356 [ACK] Seq=60467 Ack=1 Win=174 Len=1234,
79,1.137475,192.168.246.232,192.168.246.153,TCP,1288,8080  >  51356 [ACK] Seq=61701 Ack=1 Win=174 Len=1234,
80,1.137475,192.168.246.232,192.168.246.153,TCP,1288,8080  >  51356 [ACK] Seq=62935 Ack=1 Win=174 Len=1234,
81,1.137783,192.168.246.232,192.168.246.153,TCP,1288,8080  >  51356 [ACK] Seq=64169 Ack=1 Win=174 Len=1234,
82,1.137783,192.168.246.232,192.168.246.153,TCP,1288,8080  >  51356 [ACK] Seq=65403 Ack=1 Win=174 Len=1234,
83,1.138152,192.168.246.232,192.168.246.153,TCP,1288,8080  >  51356 [ACK] Seq=66637 Ack=1 Win=174 Len=1234,
84,1.138152,192.168.246.232,192.168.246.153,TCP,1288,8080  >  51356 [ACK] Seq=67871 Ack=1 Win=174 Len=1234,
85,1.138633,192.168.246.232,192.168.246.153,TCP,1288,8080  >  51356 [ACK] Seq=69105 Ack=1 Win=174 Len=1234,
86,1.138633,192.168.246.232,192.168.246.153,TCP,1288,8080  >  51356 [ACK] Seq=70339 Ack=1 Win=174 Len=1234,
87,1.13887,192.168.246.232,192.168.246.153,TCP,1288,8080  >  51356 [ACK] Seq=71573 Ack=1 Win=174 Len=1234,
88,1.13887,192.168.246.232,192.168.246.153,TCP,1288,8080  >  51356 [ACK] Seq=72807 Ack=1 Win=174 Len=1234,
89,1.139279,192.168.246.232,192.168.246.153,TCP,1288,8080  >  51356 [ACK] Seq=74041 Ack=1 Win=174 Len=1234,
90,1.139604,192.168.246.232,192.168.246.153,TCP,1288,8080  >  51356 [ACK] Seq=75275 Ack=1 Win=174 Len=1234,
92,1.16733,192.168.246.153,192.168.246.232,TCP,60,51356  >  8080 [ACK] Seq=1 Ack=45659 Win=2048 Len=0,
93,1.170925,192.168.246.232,192.168.246.153,TCP,1288,8080  >  51356 [ACK] Seq=76509 Ack=1 Win=174 Len=1234,
94,1.170925,192.168.246.232,192.168.246.153,TCP,1288,8080  >  51356 [ACK] Seq=77743 Ack=1 Win=174 Len=1234,
96,1.387827,192.168.246.153,192.168.246.232,TCP,66,[TCP Dup ACK 92#1] 51356  >  8080 [ACK] Seq=1 Ack=45659 Win=2048 Len=0 SLE=48127 SRE=49361,
97,1.390724,192.168.246.232,192.168.246.153,TCP,1288,8080  >  51356 [ACK] Seq=78977 Ack=1 Win=174 Len=1234,
98,1.390724,192.168.246.232,192.168.246.153,TCP,1288,8080  >  51356 [ACK] Seq=80211 Ack=1 Win=174 Len=1234,
99,1.696302,192.168.246.232,192.168.246.153,TCP,1288,[TCP Retransmission] 8080  >  51356 [ACK] Seq=45659 Ack=1 Win=174 Len=1234,
102,2.035434,192.168.246.153,192.168.246.232,TCP,66,[TCP Dup ACK 92#2] 51356  >  8080 [ACK] Seq=1 Ack=45659 Win=2048 Len=0 SLE=48127 SRE=50595,
103,2.053712,192.168.246.232,192.168.246.153,TCP,1288,[TCP Fast Retransmission] 8080  >  51356 [ACK] Seq=46893 Ack=1 Win=174 Len=1234,
104,2.168896,192.168.246.153,192.168.246.232,TCP,74,[TCP Dup ACK 92#3] 51356  >  8080 [ACK] Seq=1 Ack=45659 Win=2048 Len=0 SLE=51829 SRE=53063 SLE=48127 SRE=50595,
105,2.168934,192.168.246.153,192.168.246.232,TCP,74,[TCP Dup ACK 92#4] 51356  >  8080 [ACK] Seq=1 Ack=45659 Win=2048 Len=0 SLE=51829 SRE=54297 SLE=48127 SRE=50595,
106,2.168939,192.168.246.153,192.168.246.232,TCP,74,[TCP Dup ACK 92#5] 51356  >  8080 [ACK] Seq=1 Ack=45659 Win=2048 Len=0 SLE=51829 SRE=55531 SLE=48127 SRE=50595,
107,2.168944,192.168.246.153,192.168.246.232,TCP,74,[TCP Dup ACK 92#6] 51356  >  8080 [ACK] Seq=1 Ack=45659 Win=2048 Len=0 SLE=51829 SRE=56765 SLE=48127 SRE=50595,
108,2.168949,192.168.246.153,192.168.246.232,TCP,74,[TCP Dup ACK 92#7] 51356  >  8080 [ACK] Seq=1 Ack=45659 Win=2048 Len=0 SLE=51829 SRE=57999 SLE=48127 SRE=50595,
109,2.168955,192.168.246.153,192.168.246.232,TCP,74,[TCP Dup ACK 92#8] 51356  >  8080 [ACK] Seq=1 Ack=45659 Win=2048 Len=0 SLE=51829 SRE=59233 SLE=48127 SRE=50595,
110,2.168961,192.168.246.153,192.168.246.232,TCP,74,[TCP Dup ACK 92#9] 51356  >  8080 [ACK] Seq=1 Ack=45659 Win=2048 Len=0 SLE=51829 SRE=60467 SLE=48127 SRE=50595,
111,2.168967,192.168.246.153,192.168.246.232,TCP,74,[TCP Dup ACK 92#10] 51356  >  8080 [ACK] Seq=1 Ack=45659 Win=2048 Len=0 SLE=51829 SRE=61701 SLE=48127 SRE=50595,
112,2.168973,192.168.246.153,192.168.246.232,TCP,74,[TCP Dup ACK 92#11] 51356  >  8080 [ACK] Seq=1 Ack=45659 Win=2048 Len=0 SLE=51829 SRE=62935 SLE=48127 SRE=50595,
113,2.168978,192.168.246.153,192.168.246.232,TCP,74,[TCP Dup ACK 92#12] 51356  >  8080 [ACK] Seq=1 Ack=45659 Win=2048 Len=0 SLE=51829 SRE=64169 SLE=48127 SRE=50595,
114,2.168983,192.168.246.153,192.168.246.232,TCP,74,[TCP Dup ACK 92#13] 51356  >  8080 [ACK] Seq=1 Ack=45659 Win=2048 Len=0 SLE=51829 SRE=65403 SLE=48127 SRE=50595,
115,2.168989,192.168.246.153,192.168.246.232,TCP,74,[TCP Dup ACK 92#14] 51356  >  8080 [ACK] Seq=1 Ack=45659 Win=2048 Len=0 SLE=51829 SRE=66637 SLE=48127 SRE=50595,
116,2.168994,192.168.246.153,192.168.246.232,TCP,74,[TCP Dup ACK 92#15] 51356  >  8080 [ACK] Seq=1 Ack=45659 Win=2048 Len=0 SLE=51829 SRE=67871 SLE=48127 SRE=50595,
117,2.168999,192.168.246.153,192.168.246.232,TCP,74,[TCP Dup ACK 92#16] 51356  >  8080 [ACK] Seq=1 Ack=45659 Win=2048 Len=0 SLE=51829 SRE=69105 SLE=48127 SRE=50595,
118,2.169005,192.168.246.153,192.168.246.232,TCP,74,[TCP Dup ACK 92#17] 51356  >  8080 [ACK] Seq=1 Ack=45659 Win=2048 Len=0 SLE=51829 SRE=70339 SLE=48127 SRE=50595,
119,2.16901,192.168.246.153,192.168.246.232,TCP,74,[TCP Dup ACK 92#18] 51356  >  8080 [ACK] Seq=1 Ack=45659 Win=2048 Len=0 SLE=51829 SRE=71573 SLE=48127 SRE=50595,
120,2.169016,192.168.246.153,192.168.246.232,TCP,74,[TCP Dup ACK 92#19] 51356  >  8080 [ACK] Seq=1 Ack=45659 Win=2048 Len=0 SLE=51829 SRE=72807 SLE=48127 SRE=50595,
121,2.169021,192.168.246.153,192.168.246.232,TCP,74,[TCP Dup ACK 92#20] 51356  >  8080 [ACK] Seq=1 Ack=45659 Win=2048 Len=0 SLE=51829 SRE=74041 SLE=48127 SRE=50595,
122,2.169027,192.168.246.153,192.168.246.232,TCP,74,[TCP Dup ACK 92#21] 51356  >  8080 [ACK] Seq=1 Ack=45659 Win=2048 Len=0 SLE=51829 SRE=75275 SLE=48127 SRE=50595,
123,2.169035,192.168.246.153,192.168.246.232,TCP,74,[TCP Dup ACK 92#22] 51356  >  8080 [ACK] Seq=1 Ack=45659 Win=2048 Len=0 SLE=51829 SRE=76509 SLE=48127 SRE=50595,
124,2.175045,192.168.246.232,192.168.246.153,TCP,1288,[TCP Fast Retransmission] 8080  >  51356 [ACK] Seq=50595 Ack=1 Win=174 Len=1234,
125,2.175403,192.168.246.153,192.168.246.232,TCP,74,[TCP Dup ACK 92#23] 51356  >  8080 [ACK] Seq=1 Ack=45659 Win=2048 Len=0 SLE=51829 SRE=77743 SLE=48127 SRE=50595,
126,2.175438,192.168.246.153,192.168.246.232,TCP,74,[TCP Dup ACK 92#24] 51356  >  8080 [ACK] Seq=1 Ack=45659 Win=2048 Len=0 SLE=51829 SRE=78977 SLE=48127 SRE=50595,
127,2.223778,192.168.246.232,192.168.246.153,TCP,1288,8080  >  51356 [ACK] Seq=81445 Ack=1 Win=174 Len=1234,
128,2.223778,192.168.246.232,192.168.246.153,TCP,1288,8080  >  51356 [ACK] Seq=82679 Ack=1 Win=174 Len=1234,
129,2.223778,192.168.246.232,192.168.246.153,TCP,1288,8080  >  51356 [ACK] Seq=83913 Ack=1 Win=174 Len=1234,
130,2.223841,192.168.246.232,192.168.246.153,TCP,1288,8080  >  51356 [ACK] Seq=85147 Ack=1 Win=174 Len=1234,
131,2.224133,192.168.246.232,192.168.246.153,TCP,1288,8080  >  51356 [ACK] Seq=86381 Ack=1 Win=174 Len=1234,
132,2.224133,192.168.246.232,192.168.246.153,TCP,1288,8080  >  51356 [ACK] Seq=87615 Ack=1 Win=174 Len=1234,
133,2.224181,192.168.246.232,192.168.246.153,TCP,1288,8080  >  51356 [ACK] Seq=88849 Ack=1 Win=174 Len=1234,
134,2.224829,192.168.246.232,192.168.246.153,TCP,1288,8080  >  51356 [ACK] Seq=90083 Ack=1 Win=174 Len=1234,
135,2.224829,192.168.246.232,192.168.246.153,TCP,1288,8080  >  51356 [ACK] Seq=91317 Ack=1 Win=174 Len=1234,
136,2.224829,192.168.246.232,192.168.246.153,TCP,1288,8080  >  51356 [ACK] Seq=92551 Ack=1 Win=174 Len=1234,
137,2.247061,192.168.246.232,192.168.246.153,TCP,1288,8080  >  51356 [ACK] Seq=93785 Ack=1 Win=174 Len=1234,
138,2.247061,192.168.246.232,192.168.246.153,TCP,1288,8080  >  51356 [ACK] Seq=95019 Ack=1 Win=174 Len=1234,
139,2.247061,192.168.246.232,192.168.246.153,TCP,1288,8080  >  51356 [ACK] Seq=96253 Ack=1 Win=174 Len=1234,
140,2.247388,192.168.246.232,192.168.246.153,TCP,1288,8080  >  51356 [ACK] Seq=97487 Ack=1 Win=174 Len=1234,
141,2.481626,192.168.246.153,192.168.246.232,TCP,74,[TCP Dup ACK 92#25] 51356  >  8080 [ACK] Seq=1 Ack=45659 Win=2048 Len=0 SLE=51829 SRE=80211 SLE=48127 SRE=50595,
142,2.481681,192.168.246.153,192.168.246.232,TCP,74,[TCP Dup ACK 92#26] 51356  >  8080 [ACK] Seq=1 Ack=45659 Win=2048 Len=0 SLE=51829 SRE=81445 SLE=48127 SRE=50595,
143,2.502819,192.168.246.232,192.168.246.153,TCP,1288,8080  >  51356 [ACK] Seq=98721 Ack=1 Win=174 Len=1234,
144,2.502819,192.168.246.232,192.168.246.153,TCP,1288,8080  >  51356 [ACK] Seq=99955 Ack=1 Win=174 Len=1234,
145,2.748109,192.168.246.153,192.168.246.232,TCP,74,51356  >  8080 [ACK] Seq=1 Ack=46893 Win=2053 Len=0 SLE=51829 SRE=81445 SLE=48127 SRE=50595,
147,2.767436,192.168.246.232,192.168.246.153,TCP,1288,8080  >  51356 [ACK] Seq=101189 Ack=1 Win=174 Len=1234,
148,3.058041,192.168.246.153,192.168.246.232,TCP,66,51356  >  8080 [ACK] Seq=1 Ack=50595 Win=2053 Len=0 SLE=51829 SRE=81445,
149,3.079386,192.168.246.232,192.168.246.153,TCP,1288,8080  >  51356 [ACK] Seq=102423 Ack=1 Win=174 Len=1234,
150,3.18592,192.168.246.153,192.168.246.232,TCP,60,51356  >  8080 [ACK] Seq=1 Ack=81445 Win=2053 Len=0,
151,3.189527,192.168.246.232,192.168.246.153,TCP,1288,8080  >  51356 [ACK] Seq=103657 Ack=1 Win=174 Len=1234,
152,3.260438,192.168.246.153,192.168.246.232,TCP,60,51356  >  8080 [ACK] Seq=1 Ack=83913 Win=2053 Len=0,
153,3.260524,192.168.246.153,192.168.246.232,TCP,60,51356  >  8080 [ACK] Seq=1 Ack=86381 Win=2053 Len=0,
154,3.260538,192.168.246.153,192.168.246.232,TCP,60,51356  >  8080 [ACK] Seq=1 Ack=88849 Win=2053 Len=0,
155,3.260551,192.168.246.153,192.168.246.232,TCP,60,51356  >  8080 [ACK] Seq=1 Ack=91317 Win=2053 Len=0,
156,3.260567,192.168.246.153,192.168.246.232,TCP,60,51356  >  8080 [ACK] Seq=1 Ack=93785 Win=2053 Len=0,
157,3.260581,192.168.246.153,192.168.246.232,TCP,60,51356  >  8080 [ACK] Seq=1 Ack=96253 Win=2053 Len=0,
158,3.260595,192.168.246.153,192.168.246.232,TCP,60,51356  >  8080 [ACK] Seq=1 Ack=98721 Win=2053 Len=0,
159,3.265908,192.168.246.232,192.168.246.153,TCP,1288,8080  >  51356 [ACK] Seq=104891 Ack=1 Win=174 Len=1234,
160,3.265908,192.168.246.232,192.168.246.153,TCP,1288,8080  >  51356 [ACK] Seq=106125 Ack=1 Win=174 Len=1234,
161,3.267207,192.168.246.232,192.168.246.153,TCP,1288,"8080  >  51356 [PSH, ACK] Seq=107359 Ack=1 Win=174 Len=1234",
162,3.267207,192.168.246.232,192.168.246.153,TCP,1288,"8080  >  51356 [PSH, ACK] Seq=108593 Ack=1 Win=174 Len=1234",
163,3.267207,192.168.246.232,192.168.246.153,TCP,1288,8080  >  51356 [ACK] Seq=109827 Ack=1 Win=174 Len=1234,
164,3.267855,192.168.246.232,192.168.246.153,TCP,1288,8080  >  51356 [ACK] Seq=111061 Ack=1 Win=174 Len=1234,
165,3.268538,192.168.246.232,192.168.246.153,TCP,1288,8080  >  51356 [ACK] Seq=112295 Ack=1 Win=174 Len=1234,
166,3.268538,192.168.246.232,192.168.246.153,TCP,1288,8080  >  51356 [ACK] Seq=113529 Ack=1 Win=174 Len=1234,
167,3.270406,192.168.246.232,192.168.246.153,TCP,1288,8080  >  51356 [ACK] Seq=114763 Ack=1 Win=174 Len=1234,
168,3.270406,192.168.246.232,192.168.246.153,TCP,1288,8080  >  51356 [ACK] Seq=115997 Ack=1 Win=174 Len=1234,
169,3.270406,192.168.246.232,192.168.246.153,TCP,1288,8080  >  51356 [ACK] Seq=117231 Ack=1 Win=174 Len=1234,
170,3.270406,192.168.246.232,192.168.246.153,TCP,1288,8080  >  51356 [ACK] Seq=118465 Ack=1 Win=174 Len=1234,
171,3.270885,192.168.246.232,192.168.246.153,TCP,1288,8080  >  51356 [ACK] Seq=119699 Ack=1 Win=174 Len=1234,
172,3.270885,192.168.246.232,192.168.246.153,TCP,1288,8080  >  51356 [ACK] Seq=120933 Ack=1 Win=174 Len=1234,
173,3.270885,192.168.246.232,192.168.246.153,TCP,1288,8080  >  51356 [ACK] Seq=122167 Ack=1 Win=174 Len=1234,
174,3.271286,192.168.246.232,192.168.246.153,TCP,1288,8080  >  51356 [ACK] Seq=123401 Ack=1 Win=174 Len=1234,
175,3.271286,192.168.246.232,192.168.246.153,TCP,1288,8080  >  51356 [ACK] Seq=124635 Ack=1 Win=174 Len=1234,
176,3.271825,192.168.246.232,192.168.246.153,TCP,1288,8080  >  51356 [ACK] Seq=125869 Ack=1 Win=174 Len=1234,
177,3.5042,192.168.246.153,192.168.246.232,TCP,60,51356  >  8080 [ACK] Seq=1 Ack=101189 Win=2053 Len=0,
178,3.529917,192.168.246.232,192.168.246.153,TCP,1288,8080  >  51356 [ACK] Seq=127103 Ack=1 Win=174 Len=1234,
179,3.529917,192.168.246.232,192.168.246.153,TCP,1288,8080  >  51356 [ACK] Seq=128337 Ack=1 Win=174 Len=1234,
180,3.810509,192.168.246.153,192.168.246.232,TCP,60,51356  >  8080 [ACK] Seq=1 Ack=102423 Win=2048 Len=0,
181,3.814002,192.168.246.232,192.168.246.153,TCP,1288,8080  >  51356 [ACK] Seq=129571 Ack=1 Win=174 Len=1234,
182,3.814002,192.168.246.232,192.168.246.153,TCP,1288,8080  >  51356 [ACK] Seq=130805 Ack=1 Win=174 Len=1234,
183,4.121748,192.168.246.153,192.168.246.232,TCP,60,51356  >  8080 [ACK] Seq=1 Ack=103657 Win=2053 Len=0,
184,4.128984,192.168.246.232,192.168.246.153,TCP,1288,8080  >  51356 [ACK] Seq=132039 Ack=1 Win=174 Len=1234,
185,4.23235,192.168.246.153,192.168.246.232,TCP,60,51356  >  8080 [ACK] Seq=1 Ack=104891 Win=2048 Len=0,
186,4.236912,192.168.246.232,192.168.246.153,TCP,1288,8080  >  51356 [ACK] Seq=133273 Ack=1 Win=174 Len=1234,
187,4.276117,192.168.246.153,192.168.246.232,TCP,60,51356  >  8080 [ACK] Seq=1 Ack=107359 Win=2053 Len=0,
188,4.276256,192.168.246.153,192.168.246.232,TCP,60,51356  >  8080 [ACK] Seq=1 Ack=109827 Win=2053 Len=0,
189,4.276279,192.168.246.153,192.168.246.232,TCP,60,51356  >  8080 [ACK] Seq=1 Ack=112295 Win=2053 Len=0,
190,4.276298,192.168.246.153,192.168.246.232,TCP,60,51356  >  8080 [ACK] Seq=1 Ack=114763 Win=2053 Len=0,
191,4.276317,192.168.246.153,192.168.246.232,TCP,60,51356  >  8080 [ACK] Seq=1 Ack=117231 Win=2053 Len=0,
192,4.276335,192.168.246.153,192.168.246.232,TCP,60,51356  >  8080 [ACK] Seq=1 Ack=119699 Win=2053 Len=0,
193,4.276352,192.168.246.153,192.168.246.232,TCP,60,51356  >  8080 [ACK] Seq=1 Ack=122167 Win=2053 Len=0,
194,4.276372,192.168.246.153,192.168.246.232,TCP,60,51356  >  8080 [ACK] Seq=1 Ack=124635 Win=2053 Len=0,
195,4.276396,192.168.246.153,192.168.246.232,TCP,60,51356  >  8080 [ACK] Seq=1 Ack=127103 Win=2053 Len=0,
196,4.285313,192.168.246.232,192.168.246.153,TCP,1288,8080  >  51356 [ACK] Seq=134507 Ack=1 Win=174 Len=1234,
197,4.285313,192.168.246.232,192.168.246.153,TCP,1288,8080  >  51356 [ACK] Seq=135741 Ack=1 Win=174 Len=1234,
198,4.28588,192.168.246.232,192.168.246.153,TCP,1288,8080  >  51356 [ACK] Seq=136975 Ack=1 Win=174 Len=1234,
199,4.28588,192.168.246.232,192.168.246.153,TCP,1288,8080  >  51356 [ACK] Seq=138209 Ack=1 Win=174 Len=1234,
200,4.28588,192.168.246.232,192.168.246.153,TCP,1288,8080  >  51356 [ACK] Seq=139443 Ack=1 Win=174 Len=1234,
201,4.286577,192.168.246.232,192.168.246.153,TCP,1288,8080  >  51356 [ACK] Seq=140677 Ack=1 Win=174 Len=1234,
202,4.286577,192.168.246.232,192.168.246.153,TCP,1288,8080  >  51356 [ACK] Seq=141911 Ack=1 Win=174 Len=1234,
203,4.286577,192.168.246.232,192.168.246.153,TCP,1288,8080  >  51356 [ACK] Seq=143145 Ack=1 Win=174 Len=1234,
204,4.287332,192.168.246.232,192.168.246.153,TCP,1288,8080  >  51356 [ACK] Seq=144379 Ack=1 Win=174 Len=1234,
205,4.287332,192.168.246.232,192.168.246.153,TCP,1288,8080  >  51356 [ACK] Seq=145613 Ack=1 Win=174 Len=1234,
206,4.287332,192.168.246.232,192.168.246.153,TCP,1288,8080  >  51356 [ACK] Seq=146847 Ack=1 Win=174 Len=1234,
207,4.28764,192.168.246.232,192.168.246.153,TCP,1288,8080  >  51356 [ACK] Seq=148081 Ack=1 Win=174 Len=1234,
208,4.28764,192.168.246.232,192.168.246.153,TCP,1288,8080  >  51356 [ACK] Seq=149315 Ack=1 Win=174 Len=1234,
209,4.288013,192.168.246.232,192.168.246.153,TCP,1288,8080  >  51356 [ACK] Seq=150549 Ack=1 Win=174 Len=1234,
210,4.288013,192.168.246.232,192.168.246.153,TCP,1288,8080  >  51356 [ACK] Seq=151783 Ack=1 Win=174 Len=1234,
211,4.288353,192.168.246.232,192.168.246.153,TCP,1288,8080  >  51356 [ACK] Seq=153017 Ack=1 Win=174 Len=1234,
212,4.288353,192.168.246.232,192.168.246.153,TCP,1288,8080  >  51356 [ACK] Seq=154251 Ack=1 Win=174 Len=1234,
213,4.288907,192.168.246.232,192.168.246.153,TCP,1288,8080  >  51356 [ACK] Seq=155485 Ack=1 Win=174 Len=1234,
214,4.288907,192.168.246.232,192.168.246.153,TCP,1288,8080  >  51356 [ACK] Seq=156719 Ack=1 Win=174 Len=1234,
215,4.2894,192.168.246.232,192.168.246.153,TCP,1288,8080  >  51356 [ACK] Seq=157953 Ack=1 Win=174 Len=1234,
216,4.2894,192.168.246.232,192.168.246.153,TCP,1288,8080  >  51356 [ACK] Seq=159187 Ack=1 Win=174 Len=1234,
217,4.542197,192.168.246.153,192.168.246.232,TCP,60,51356  >  8080 [ACK] Seq=1 Ack=129571 Win=2053 Len=0,
218,4.551283,192.168.246.232,192.168.246.153,TCP,1288,8080  >  51356 [ACK] Seq=160421 Ack=1 Win=174 Len=1234,
219,4.551298,192.168.246.232,192.168.246.153,TCP,1288,8080  >  51356 [ACK] Seq=161655 Ack=1 Win=174 Len=1234,
220,5.06912,192.168.246.232,192.168.246.153,TCP,1288,8080  >  51356 [ACK] Seq=162889 Ack=1 Win=174 Len=1234,
221,5.291526,192.168.246.153,192.168.246.232,TCP,66,51356  >  8080 [ACK] Seq=1 Ack=132039 Win=2053 Len=0 SLE=133273 SRE=134507,
222,5.299052,192.168.246.153,192.168.246.232,TCP,66,[TCP Dup ACK 221#1] 51356  >  8080 [ACK] Seq=1 Ack=132039 Win=2053 Len=0 SLE=133273 SRE=135741,
223,5.299085,192.168.246.153,192.168.246.232,TCP,66,[TCP Dup ACK 221#2] 51356  >  8080 [ACK] Seq=1 Ack=132039 Win=2053 Len=0 SLE=133273 SRE=136975,
224,5.299094,192.168.246.153,192.168.246.232,TCP,66,[TCP Dup ACK 221#3] 51356  >  8080 [ACK] Seq=1 Ack=132039 Win=2053 Len=0 SLE=133273 SRE=138209,
225,5.299101,192.168.246.153,192.168.246.232,TCP,66,[TCP Dup ACK 221#4] 51356  >  8080 [ACK] Seq=1 Ack=132039 Win=2053 Len=0 SLE=133273 SRE=139443,
226,5.299111,192.168.246.153,192.168.246.232,TCP,66,[TCP Dup ACK 221#5] 51356  >  8080 [ACK] Seq=1 Ack=132039 Win=2053 Len=0 SLE=133273 SRE=140677,
227,5.299119,192.168.246.153,192.168.246.232,TCP,66,[TCP Dup ACK 221#6] 51356  >  8080 [ACK] Seq=1 Ack=132039 Win=2053 Len=0 SLE=133273 SRE=141911,
228,5.299127,192.168.246.153,192.168.246.232,TCP,66,[TCP Dup ACK 221#7] 51356  >  8080 [ACK] Seq=1 Ack=132039 Win=2053 Len=0 SLE=133273 SRE=143145,
229,5.299136,192.168.246.153,192.168.246.232,TCP,66,[TCP Dup ACK 221#8] 51356  >  8080 [ACK] Seq=1 Ack=132039 Win=2053 Len=0 SLE=133273 SRE=144379,
230,5.299144,192.168.246.153,192.168.246.232,TCP,66,[TCP Dup ACK 221#9] 51356  >  8080 [ACK] Seq=1 Ack=132039 Win=2053 Len=0 SLE=133273 SRE=145613,
231,5.299152,192.168.246.153,192.168.246.232,TCP,66,[TCP Dup ACK 221#10] 51356  >  8080 [ACK] Seq=1 Ack=132039 Win=2053 Len=0 SLE=133273 SRE=146847,
232,5.299161,192.168.246.153,192.168.246.232,TCP,66,[TCP Dup ACK 221#11] 51356  >  8080 [ACK] Seq=1 Ack=132039 Win=2053 Len=0 SLE=133273 SRE=148081,
233,5.299169,192.168.246.153,192.168.246.232,TCP,66,[TCP Dup ACK 221#12] 51356  >  8080 [ACK] Seq=1 Ack=132039 Win=2053 Len=0 SLE=133273 SRE=149315,
234,5.299177,192.168.246.153,192.168.246.232,TCP,66,[TCP Dup ACK 221#13] 51356  >  8080 [ACK] Seq=1 Ack=132039 Win=2053 Len=0 SLE=133273 SRE=150549,
235,5.299186,192.168.246.153,192.168.246.232,TCP,66,[TCP Dup ACK 221#14] 51356  >  8080 [ACK] Seq=1 Ack=132039 Win=2053 Len=0 SLE=133273 SRE=151783,
236,5.299193,192.168.246.153,192.168.246.232,TCP,66,[TCP Dup ACK 221#15] 51356  >  8080 [ACK] Seq=1 Ack=132039 Win=2053 Len=0 SLE=133273 SRE=153017,
237,5.299202,192.168.246.153,192.168.246.232,TCP,66,[TCP Dup ACK 221#16] 51356  >  8080 [ACK] Seq=1 Ack=132039 Win=2053 Len=0 SLE=133273 SRE=154251,
238,5.29921,192.168.246.153,192.168.246.232,TCP,66,[TCP Dup ACK 221#17] 51356  >  8080 [ACK] Seq=1 Ack=132039 Win=2053 Len=0 SLE=133273 SRE=155485,
239,5.299217,192.168.246.153,192.168.246.232,TCP,66,[TCP Dup ACK 221#18] 51356  >  8080 [ACK] Seq=1 Ack=132039 Win=2053 Len=0 SLE=133273 SRE=156719,
240,5.299225,192.168.246.153,192.168.246.232,TCP,66,[TCP Dup ACK 221#19] 51356  >  8080 [ACK] Seq=1 Ack=132039 Win=2053 Len=0 SLE=133273 SRE=157953,
241,5.299233,192.168.246.153,192.168.246.232,TCP,66,[TCP Dup ACK 221#20] 51356  >  8080 [ACK] Seq=1 Ack=132039 Win=2053 Len=0 SLE=133273 SRE=159187,
242,5.319392,192.168.246.232,192.168.246.153,TCP,1288,8080  >  51356 [ACK] Seq=164123 Ack=1 Win=174 Len=1234,
243,5.319392,192.168.246.232,192.168.246.153,TCP,1288,8080  >  51356 [ACK] Seq=165357 Ack=1 Win=174 Len=1234,
244,5.31996,192.168.246.232,192.168.246.153,TCP,1288,[TCP Retransmission] 8080  >  51356 [ACK] Seq=132039 Ack=1 Win=174 Len=1234,
245,5.320973,192.168.246.232,192.168.246.153,TCP,1288,8080  >  51356 [ACK] Seq=166591 Ack=1 Win=174 Len=1234,
246,5.320973,192.168.246.232,192.168.246.153,TCP,1288,8080  >  51356 [ACK] Seq=167825 Ack=1 Win=174 Len=1234,
247,5.320973,192.168.246.232,192.168.246.153,TCP,1288,8080  >  51356 [ACK] Seq=169059 Ack=1 Win=174 Len=1234,
248,5.321466,192.168.246.232,192.168.246.153,TCP,1288,8080  >  51356 [ACK] Seq=170293 Ack=1 Win=174 Len=1234,
249,5.321466,192.168.246.232,192.168.246.153,TCP,1288,8080  >  51356 [ACK] Seq=171527 Ack=1 Win=174 Len=1234,
250,5.322799,192.168.246.232,192.168.246.153,TCP,1288,8080  >  51356 [ACK] Seq=172761 Ack=1 Win=174 Len=1234,
251,5.322799,192.168.246.232,192.168.246.153,TCP,1288,8080  >  51356 [ACK] Seq=173995 Ack=1 Win=174 Len=1234,
252,5.322799,192.168.246.232,192.168.246.153,TCP,1288,8080  >  51356 [ACK] Seq=175229 Ack=1 Win=174 Len=1234,
253,5.322875,192.168.246.232,192.168.246.153,TCP,1288,8080  >  51356 [ACK] Seq=176463 Ack=1 Win=174 Len=1234,
254,5.32354,192.168.246.232,192.168.246.153,TCP,1288,8080  >  51356 [ACK] Seq=177697 Ack=1 Win=174 Len=1234,
255,5.32354,192.168.246.232,192.168.246.153,TCP,1288,8080  >  51356 [ACK] Seq=178931 Ack=1 Win=174 Len=1234,
256,5.552939,192.168.246.153,192.168.246.232,TCP,66,[TCP Dup ACK 221#21] 51356  >  8080 [ACK] Seq=1 Ack=132039 Win=2053 Len=0 SLE=133273 SRE=161655,
257,5.553045,192.168.246.153,192.168.246.232,TCP,66,[TCP Dup ACK 221#22] 51356  >  8080 [ACK] Seq=1 Ack=132039 Win=2053 Len=0 SLE=133273 SRE=162889,
258,5.555786,192.168.246.232,192.168.246.153,TCP,1288,8080  >  51356 [ACK] Seq=180165 Ack=1 Win=174 Len=1234,
259,5.555786,192.168.246.232,192.168.246.153,TCP,1288,8080  >  51356 [ACK] Seq=181399 Ack=1 Win=174 Len=1234,
260,5.555991,192.168.246.232,192.168.246.153,TCP,1288,8080  >  51356 [ACK] Seq=182633 Ack=1 Win=174 Len=1234,
269,6.071656,192.168.246.153,192.168.246.232,TCP,66,[TCP Dup ACK 221#23] 51356  >  8080 [ACK] Seq=1 Ack=132039 Win=2053 Len=0 SLE=133273 SRE=164123,
270,6.075785,192.168.246.232,192.168.246.153,TCP,1288,8080  >  51356 [ACK] Seq=183867 Ack=1 Win=174 Len=1234,
271,6.349487,192.168.246.153,192.168.246.232,TCP,66,[TCP Dup ACK 221#24] 51356  >  8080 [ACK] Seq=1 Ack=132039 Win=2053 Len=0 SLE=133273 SRE=165357,
272,6.34956,192.168.246.153,192.168.246.232,TCP,66,[TCP Dup ACK 221#25] 51356  >  8080 [ACK] Seq=1 Ack=132039 Win=2053 Len=0 SLE=133273 SRE=166591,
273,6.349572,192.168.246.153,192.168.246.232,TCP,60,51356  >  8080 [ACK] Seq=1 Ack=166591 Win=2053 Len=0,
274,6.349584,192.168.246.153,192.168.246.232,TCP,60,51356  >  8080 [ACK] Seq=1 Ack=169059 Win=2053 Len=0,
275,6.349597,192.168.246.153,192.168.246.232,TCP,60,51356  >  8080 [ACK] Seq=1 Ack=171527 Win=2053 Len=0,
276,6.365387,192.168.246.153,192.168.246.232,TCP,60,51356  >  8080 [ACK] Seq=1 Ack=172761 Win=2048 Len=0,
277,6.365445,192.168.246.153,192.168.246.232,TCP,60,51356  >  8080 [ACK] Seq=1 Ack=175229 Win=2053 Len=0,
278,6.365455,192.168.246.153,192.168.246.232,TCP,60,51356  >  8080 [ACK] Seq=1 Ack=177697 Win=2053 Len=0,
279,6.365465,192.168.246.153,192.168.246.232,TCP,60,51356  >  8080 [ACK] Seq=1 Ack=180165 Win=2053 Len=0,
280,6.375207,192.168.246.232,192.168.246.153,TCP,1288,8080  >  51356 [ACK] Seq=185101 Ack=1 Win=174 Len=1234,
281,6.375207,192.168.246.232,192.168.246.153,TCP,1288,8080  >  51356 [ACK] Seq=186335 Ack=1 Win=174 Len=1234,
282,6.375207,192.168.246.232,192.168.246.153,TCP,1288,8080  >  51356 [ACK] Seq=187569 Ack=1 Win=174 Len=1234,
283,6.375207,192.168.246.232,192.168.246.153,TCP,1288,8080  >  51356 [ACK] Seq=188803 Ack=1 Win=174 Len=1234,
284,6.375207,192.168.246.232,192.168.246.153,TCP,1288,8080  >  51356 [ACK] Seq=190037 Ack=1 Win=174 Len=1234,
285,6.375207,192.168.246.232,192.168.246.153,TCP,1288,8080  >  51356 [ACK] Seq=191271 Ack=1 Win=174 Len=1234,
286,6.375207,192.168.246.232,192.168.246.153,TCP,1288,8080  >  51356 [ACK] Seq=192505 Ack=1 Win=174 Len=1234,
287,6.375207,192.168.246.232,192.168.246.153,TCP,1288,8080  >  51356 [ACK] Seq=193739 Ack=1 Win=174 Len=1234,
288,6.375207,192.168.246.232,192.168.246.153,TCP,1288,8080  >  51356 [ACK] Seq=194973 Ack=1 Win=174 Len=1234,
289,6.375207,192.168.246.232,192.168.246.153,TCP,1288,8080  >  51356 [ACK] Seq=196207 Ack=1 Win=174 Len=1234,
290,6.375207,192.168.246.232,192.168.246.153,TCP,1288,8080  >  51356 [ACK] Seq=197441 Ack=1 Win=174 Len=1234,
291,6.375207,192.168.246.232,192.168.246.153,TCP,1288,8080  >  51356 [ACK] Seq=198675 Ack=1 Win=174 Len=1234,
292,6.375884,192.168.246.232,192.168.246.153,TCP,1288,8080  >  51356 [ACK] Seq=199909 Ack=1 Win=174 Len=1234,
293,6.375884,192.168.246.232,192.168.246.153,TCP,1288,8080  >  51356 [ACK] Seq=201143 Ack=1 Win=174 Len=1234,
294,6.375924,192.168.246.232,192.168.246.153,TCP,1288,8080  >  51356 [ACK] Seq=202377 Ack=1 Win=174 Len=1234,
295,6.376466,192.168.246.232,192.168.246.153,TCP,1288,8080  >  51356 [ACK] Seq=203611 Ack=1 Win=174 Len=1234,
296,6.56783,192.168.246.153,192.168.246.232,TCP,60,51356  >  8080 [ACK] Seq=1 Ack=182633 Win=2053 Len=0,
297,6.57082,192.168.246.232,192.168.246.153,TCP,1288,8080  >  51356 [ACK] Seq=204845 Ack=1 Win=174 Len=1234,
298,6.57082,192.168.246.232,192.168.246.153,TCP,1288,8080  >  51356 [ACK] Seq=206079 Ack=1 Win=174 Len=1234,
299,6.618883,192.168.246.153,192.168.246.232,TCP,60,51356  >  8080 [ACK] Seq=1 Ack=183867 Win=2048 Len=0,
300,6.622486,192.168.246.232,192.168.246.153,TCP,1288,8080  >  51356 [ACK] Seq=207313 Ack=1 Win=174 Len=1234,
302,7.224924,192.168.246.153,192.168.246.232,TCP,60,51356  >  8080 [ACK] Seq=1 Ack=185101 Win=2053 Len=0,
303,7.243545,192.168.246.232,192.168.246.153,TCP,1288,8080  >  51356 [ACK] Seq=208547 Ack=1 Win=174 Len=1234,
304,7.401086,192.168.246.153,192.168.246.232,TCP,60,51356  >  8080 [ACK] Seq=1 Ack=187569 Win=2053 Len=0,
305,7.401123,192.168.246.153,192.168.246.232,TCP,60,51356  >  8080 [ACK] Seq=1 Ack=190037 Win=2053 Len=0,
306,7.401129,192.168.246.153,192.168.246.232,TCP,60,51356  >  8080 [ACK] Seq=1 Ack=192505 Win=2053 Len=0,
307,7.401134,192.168.246.153,192.168.246.232,TCP,60,51356  >  8080 [ACK] Seq=1 Ack=194973 Win=2053 Len=0,
308,7.401138,192.168.246.153,192.168.246.232,TCP,60,51356  >  8080 [ACK] Seq=1 Ack=197441 Win=2053 Len=0,
309,7.401143,192.168.246.153,192.168.246.232,TCP,60,51356  >  8080 [ACK] Seq=1 Ack=199909 Win=2053 Len=0,
310,7.401148,192.168.246.153,192.168.246.232,TCP,60,51356  >  8080 [ACK] Seq=1 Ack=202377 Win=2053 Len=0,
311,7.401153,192.168.246.153,192.168.246.232,TCP,60,51356  >  8080 [ACK] Seq=1 Ack=204845 Win=2053 Len=0,
312,7.405821,192.168.246.232,192.168.246.153,TCP,1288,8080  >  51356 [ACK] Seq=209781 Ack=1 Win=174 Len=1234,
313,7.405821,192.168.246.232,192.168.246.153,TCP,1288,8080  >  51356 [ACK] Seq=211015 Ack=1 Win=174 Len=1234,
314,7.406664,192.168.246.232,192.168.246.153,TCP,1288,8080  >  51356 [ACK] Seq=212249 Ack=1 Win=174 Len=1234,
315,7.406664,192.168.246.232,192.168.246.153,TCP,1288,8080  >  51356 [ACK] Seq=213483 Ack=1 Win=174 Len=1234,
316,7.407337,192.168.246.232,192.168.246.153,TCP,1288,8080  >  51356 [ACK] Seq=214717 Ack=1 Win=174 Len=1234,
317,7.407337,192.168.246.232,192.168.246.153,TCP,1288,8080  >  51356 [ACK] Seq=215951 Ack=1 Win=174 Len=1234,
318,7.407729,192.168.246.232,192.168.246.153,TCP,1288,8080  >  51356 [ACK] Seq=217185 Ack=1 Win=174 Len=1234,
319,7.407729,192.168.246.232,192.168.246.153,TCP,1288,8080  >  51356 [ACK] Seq=218419 Ack=1 Win=174 Len=1234,
320,7.408145,192.168.246.232,192.168.246.153,TCP,1288,8080  >  51356 [ACK] Seq=219653 Ack=1 Win=174 Len=1234,
321,7.408145,192.168.246.232,192.168.246.153,TCP,1288,8080  >  51356 [ACK] Seq=220887 Ack=1 Win=174 Len=1234,
322,7.408813,192.168.246.232,192.168.246.153,TCP,1288,8080  >  51356 [ACK] Seq=222121 Ack=1 Win=174 Len=1234,
323,7.408813,192.168.246.232,192.168.246.153,TCP,1288,8080  >  51356 [ACK] Seq=223355 Ack=1 Win=174 Len=1234,
324,7.408813,192.168.246.232,192.168.246.153,TCP,1288,8080  >  51356 [ACK] Seq=224589 Ack=1 Win=174 Len=1234,
325,7.409198,192.168.246.232,192.168.246.153,TCP,1288,8080  >  51356 [ACK] Seq=225823 Ack=1 Win=174 Len=1234,
326,7.409198,192.168.246.232,192.168.246.153,TCP,1288,8080  >  51356 [ACK] Seq=227057 Ack=1 Win=174 Len=1234,
327,7.40971,192.168.246.232,192.168.246.153,TCP,1288,8080  >  51356 [ACK] Seq=228291 Ack=1 Win=174 Len=1234,
328,7.583761,192.168.246.153,192.168.246.232,TCP,60,51356  >  8080 [ACK] Seq=1 Ack=207313 Win=2053 Len=0,
329,7.58812,192.168.246.232,192.168.246.153,TCP,1288,8080  >  51356 [ACK] Seq=229525 Ack=1 Win=174 Len=1234,
330,7.58812,192.168.246.232,192.168.246.153,TCP,1288,8080  >  51356 [ACK] Seq=230759 Ack=1 Win=174 Len=1234,
332,7.767553,192.168.246.153,192.168.246.232,TCP,60,51356  >  8080 [ACK] Seq=1 Ack=208547 Win=2048 Len=0,
333,7.771347,192.168.246.232,192.168.246.153,TCP,1288,8080  >  51356 [ACK] Seq=231993 Ack=1 Win=174 Len=1234,
334,7.771347,192.168.246.232,192.168.246.153,TCP,1288,8080  >  51356 [ACK] Seq=233227 Ack=1 Win=174 Len=1234,
335,8.289281,192.168.246.153,192.168.246.232,TCP,60,51356  >  8080 [ACK] Seq=1 Ack=209781 Win=2053 Len=0,
336,8.308571,192.168.246.232,192.168.246.153,TCP,1288,8080  >  51356 [ACK] Seq=234461 Ack=1 Win=174 Len=1234,
337,8.507774,192.168.246.153,192.168.246.232,TCP,60,51356  >  8080 [ACK] Seq=1 Ack=212249 Win=2053 Len=0,
338,8.507856,192.168.246.153,192.168.246.232,TCP,60,51356  >  8080 [ACK] Seq=1 Ack=214717 Win=2053 Len=0,
339,8.507871,192.168.246.153,192.168.246.232,TCP,60,51356  >  8080 [ACK] Seq=1 Ack=217185 Win=2053 Len=0,
340,8.507884,192.168.246.153,192.168.246.232,TCP,60,51356  >  8080 [ACK] Seq=1 Ack=219653 Win=2053 Len=0,
341,8.5079,192.168.246.153,192.168.246.232,TCP,60,51356  >  8080 [ACK] Seq=1 Ack=222121 Win=2053 Len=0,
342,8.507913,192.168.246.153,192.168.246.232,TCP,60,51356  >  8080 [ACK] Seq=1 Ack=224589 Win=2053 Len=0,
343,8.507926,192.168.246.153,192.168.246.232,TCP,60,51356  >  8080 [ACK] Seq=1 Ack=227057 Win=2053 Len=0,
344,8.507938,192.168.246.153,192.168.246.232,TCP,60,51356  >  8080 [ACK] Seq=1 Ack=229525 Win=2053 Len=0,
345,8.515754,192.168.246.232,192.168.246.153,TCP,1288,8080  >  51356 [ACK] Seq=235695 Ack=1 Win=174 Len=1234,
346,8.515754,192.168.246.232,192.168.246.153,TCP,1288,8080  >  51356 [ACK] Seq=236929 Ack=1 Win=174 Len=1234,
347,8.516636,192.168.246.232,192.168.246.153,TCP,1288,8080  >  51356 [ACK] Seq=238163 Ack=1 Win=174 Len=1234,
348,8.516636,192.168.246.232,192.168.246.153,TCP,1288,8080  >  51356 [ACK] Seq=239397 Ack=1 Win=174 Len=1234,
349,8.516636,192.168.246.232,192.168.246.153,TCP,1288,8080  >  51356 [ACK] Seq=240631 Ack=1 Win=174 Len=1234,
350,8.517243,192.168.246.232,192.168.246.153,TCP,1288,8080  >  51356 [ACK] Seq=241865 Ack=1 Win=174 Len=1234,
351,8.517243,192.168.246.232,192.168.246.153,TCP,1288,8080  >  51356 [ACK] Seq=243099 Ack=1 Win=174 Len=1234,
352,8.517706,192.168.246.232,192.168.246.153,TCP,1288,8080  >  51356 [ACK] Seq=244333 Ack=1 Win=174 Len=1234,
353,8.517706,192.168.246.232,192.168.246.153,TCP,1288,8080  >  51356 [ACK] Seq=245567 Ack=1 Win=174 Len=1234,
354,8.518063,192.168.246.232,192.168.246.153,TCP,1288,8080  >  51356 [ACK] Seq=246801 Ack=1 Win=174 Len=1234,
355,8.518063,192.168.246.232,192.168.246.153,TCP,1288,8080  >  51356 [ACK] Seq=248035 Ack=1 Win=174 Len=1234,
356,8.518579,192.168.246.232,192.168.246.153,TCP,1288,8080  >  51356 [ACK] Seq=249269 Ack=1 Win=174 Len=1234,
357,8.518579,192.168.246.232,192.168.246.153,TCP,1288,8080  >  51356 [ACK] Seq=250503 Ack=1 Win=174 Len=1234,
358,8.51916,192.168.246.232,192.168.246.153,TCP,1288,8080  >  51356 [ACK] Seq=251737 Ack=1 Win=174 Len=1234,
359,8.51916,192.168.246.232,192.168.246.153,TCP,1288,8080  >  51356 [ACK] Seq=252971 Ack=1 Win=174 Len=1234,
360,8.51916,192.168.246.232,192.168.246.153,TCP,1288,8080  >  51356 [ACK] Seq=254205 Ack=1 Win=174 Len=1234,
361,8.519652,192.168.246.232,192.168.246.153,TCP,1288,8080  >  51356 [ACK] Seq=255439 Ack=1 Win=174 Len=1234,
362,8.619875,192.168.246.153,192.168.246.232,TCP,60,51356  >  8080 [ACK] Seq=1 Ack=231993 Win=2053 Len=0,
363,8.622614,192.168.246.232,192.168.246.153,TCP,1288,8080  >  51356 [ACK] Seq=256673 Ack=1 Win=174 Len=1234,
364,8.622614,192.168.246.232,192.168.246.153,TCP,1288,8080  >  51356 [ACK] Seq=257907 Ack=1 Win=174 Len=1234,
365,8.796098,192.168.246.153,192.168.246.232,TCP,60,51356  >  8080 [ACK] Seq=1 Ack=234461 Win=2053 Len=0,
366,8.853077,192.168.246.232,192.168.246.153,TCP,1288,8080  >  51356 [ACK] Seq=259141 Ack=1 Win=174 Len=1234,
367,8.853077,192.168.246.232,192.168.246.153,TCP,1288,8080  >  51356 [ACK] Seq=260375 Ack=1 Win=174 Len=1234,
372,9.36764,192.168.246.153,192.168.246.232,TCP,60,51356  >  8080 [ACK] Seq=1 Ack=235695 Win=2048 Len=0,
373,9.370243,192.168.246.232,192.168.246.153,TCP,1288,8080  >  51356 [ACK] Seq=261609 Ack=1 Win=174 Len=1234,
374,9.370243,192.168.246.232,192.168.246.153,TCP,1288,8080  >  51356 [ACK] Seq=262843 Ack=1 Win=174 Len=1234,
375,9.564275,192.168.246.153,192.168.246.232,TCP,60,51356  >  8080 [ACK] Seq=1 Ack=238163 Win=2053 Len=0,
376,9.564592,192.168.246.153,192.168.246.232,TCP,60,51356  >  8080 [ACK] Seq=1 Ack=240631 Win=2053 Len=0,
377,9.564614,192.168.246.153,192.168.246.232,TCP,60,51356  >  8080 [ACK] Seq=1 Ack=243099 Win=2053 Len=0,
378,9.564635,192.168.246.153,192.168.246.232,TCP,60,51356  >  8080 [ACK] Seq=1 Ack=245567 Win=2053 Len=0,
379,9.564655,192.168.246.153,192.168.246.232,TCP,60,51356  >  8080 [ACK] Seq=1 Ack=248035 Win=2053 Len=0,
380,9.564673,192.168.246.153,192.168.246.232,TCP,60,51356  >  8080 [ACK] Seq=1 Ack=250503 Win=2053 Len=0,
381,9.564692,192.168.246.153,192.168.246.232,TCP,60,51356  >  8080 [ACK] Seq=1 Ack=252971 Win=2053 Len=0,
382,9.56471,192.168.246.153,192.168.246.232,TCP,60,51356  >  8080 [ACK] Seq=1 Ack=255439 Win=2053 Len=0,
383,9.568968,192.168.246.232,192.168.246.153,TCP,1288,8080  >  51356 [ACK] Seq=264077 Ack=1 Win=174 Len=1234,
384,9.568968,192.168.246.232,192.168.246.153,TCP,1288,8080  >  51356 [ACK] Seq=265311 Ack=1 Win=174 Len=1234,
385,9.568968,192.168.246.232,192.168.246.153,TCP,1288,8080  >  51356 [ACK] Seq=266545 Ack=1 Win=174 Len=1234,
386,9.569392,192.168.246.232,192.168.246.153,TCP,1288,8080  >  51356 [ACK] Seq=267779 Ack=1 Win=174 Len=1234,
387,9.569392,192.168.246.232,192.168.246.153,TCP,1288,8080  >  51356 [ACK] Seq=269013 Ack=1 Win=174 Len=1234,
388,9.569392,192.168.246.232,192.168.246.153,TCP,1288,8080  >  51356 [ACK] Seq=270247 Ack=1 Win=174 Len=1234,
389,9.57078,192.168.246.232,192.168.246.153,TCP,1288,8080  >  51356 [ACK] Seq=271481 Ack=1 Win=174 Len=1234,
390,9.57078,192.168.246.232,192.168.246.153,TCP,1288,8080  >  51356 [ACK] Seq=272715 Ack=1 Win=174 Len=1234,
391,9.57078,192.168.246.232,192.168.246.153,TCP,1288,8080  >  51356 [ACK] Seq=273949 Ack=1 Win=174 Len=1234,
